{
  "$schema": "https://json-schema.org/draft/2020-12/schema",
  "$id": "schemas/EnemyArchetypeConfig.schema.json",
  "title": "EnemyArchetypeConfig",
  "type": "object",
  "additionalProperties": false,
  "required": ["archetypeId", "baseScale", "hitShake", "shellOpacity", "coreGlow", "weakPointStyle", "deathStyle"],
  "properties": {
    "archetypeId": { "type": "string" },
    "baseScale": { "type": "number" },
    "hitShake": { "type": "number", "minimum": 0, "maximum": 5, "default": 0 },
    "shellOpacity": { "type": "number" },
    "coreGlow": { "type": "number" },
    "weakPointStyle": { "type": "string", "enum": ["crack", "pulse", "ring"] },
    "deathStyle": { "type": "string", "enum": ["shatter", "peel", "explode"] }
  }
}
