[
  {
    "archetypeId": "Regenerator",
    "baseScale": 1.0,
    "hitShake": 0,
    "coreGlow": 1.0,
    "shellOpacity": 0.6,
    "weakPointStyle": "pulse",
    "deathStyle": "shatter"
  },
  {
    "archetypeId": "Standard",
    "baseScale": 1.0,
    "hitShake": 0,
    "coreGlow": 1.0,
    "shellOpacity": 0.6,
    "weakPointStyle": "pulse",
    "deathStyle": "shatter"
  }
]
